{
  "generated_at": "2026-02-13T11:45:32.584330+00:00",
  "total": 1,
  "passed": 1,
  "failed": 0,
  "skipped": 0,
  "errors": 0,
  "results": [
    {
      "use_case_id": "UC-CMD-HEALTH-TRIAGE-0001",
      "scenario_title": "Command Centre reports healthy ED triage statuses after one task",
      "poc_demo": "command-centre",
      "scenario_type": "positive",
      "requirement_ids": [
        "MON-1",
        "FR-3",
        "FR-4",
        "FR-5"
      ],
      "status": "pass",
      "message": "",
      "duration_ms": 5859.9999999999
    }
  ]
}